<RoleLibrary xmlns:xsi="http://www.w3.org/2001/XMLSchema-instance"
xsi:noNamespaceSchemaLocation="./schemas/RoleLibrary.xsd">

  <Role name="Customer">
    <ActivationConditions>
      <Property name="[AGENT](location)" operator="=" value="InsideBar"/>
      <Property name="[AGENT](isPerson)" operator="=" value="True"/>
    </ActivationConditions>
    <ExpirationConditions>
      <Property name="[AGENT](location)" operator="=" value="Outside"/> 
    </ExpirationConditions>
  </Role>
  
  <Role name="Person">
    <ActivationConditions>
      <Property name="[AGENT](isPerson)" operator="=" value="True"/>
    </ActivationConditions>
    <ExpirationConditions>
	  <Property name="[AGENT](isPerson)" operator="=" value="False"/> 
    </ExpirationConditions>
  </Role>
   
</RoleLibrary>